{
  "$schema": "https://json-schema.org/draft/2020-12/schema",
  "$id": "urn:project-a:PROJECT_A_CANONICAL_EVENT_V1",
  "title": "PROJECT_A_CANONICAL_EVENT_V1",
  "type": "object",
  "additionalProperties": false,
  "required": ["contract_family", "schema_version", "source_wire_version", "wire_event", "receipt", "canonical_event_id", "canonical_content_hash", "semantic_evidence_hash", "setup_id", "correlation_id", "causation_id", "validation", "dedupe", "execution_profile", "audit"],
  "properties": {
    "contract_family": {"const": "PROJECT_A_CANONICAL_EVENT"},
    "schema_version": {"const": "1.0"},
    "source_wire_version": {"const": "1.0"},
    "wire_event": {"$ref": "urn:project-a:PROJECT_A_WIRE_EVENT_V1"},
    "receipt": {
      "type": "object", "additionalProperties": false,
      "required": ["receipt_id", "received_at", "transport_identity", "source_adapter_identity", "raw_content_hash"],
      "properties": {
        "receipt_id": {"type": "string", "pattern": "^rcpt_[A-Za-z0-9._:-]{8,120}$"},
        "received_at": {"$ref": "#/$defs/utc"},
        "transport_identity": {"type": "string", "pattern": "^[A-Za-z0-9][A-Za-z0-9._:-]{2,119}$"},
        "source_adapter_identity": {"type": "string", "pattern": "^[A-Za-z0-9][A-Za-z0-9._:-]{2,119}$"},
        "raw_content_hash": {"$ref": "#/$defs/hash"}
      }
    },
    "canonical_event_id": {"type": "string", "pattern": "^cevt_[0-9a-f]{64}$"},
    "canonical_content_hash": {"$ref": "#/$defs/hash"},
    "semantic_evidence_hash": {"$ref": "#/$defs/hash"},
    "setup_id": {"type": ["string", "null"], "pattern": "^setup_[0-9a-f]{32}$"},
    "correlation_id": {"type": ["string", "null"], "pattern": "^corr_[A-Za-z0-9._:-]{8,120}$"},
    "causation_id": {"type": ["string", "null"], "pattern": "^[A-Za-z][A-Za-z0-9._:-]{7,127}$"},
    "validation": {
      "type": "object", "additionalProperties": false,
      "required": ["status", "reason_codes", "state_mutation_allowed", "dispatch_allowed"],
      "properties": {
        "status": {"type": "string", "enum": ["ACCEPTED", "REJECTED", "DUPLICATE", "UNSUPPORTED"]},
        "reason_codes": {"type": "array", "minItems": 1, "maxItems": 8, "uniqueItems": true, "items": {"type": "string", "pattern": "^[A-Z][A-Z0-9_]{1,63}$"}},
        "state_mutation_allowed": {"type": "boolean"},
        "dispatch_allowed": {"type": "boolean"}
      }
    },
    "dedupe": {
      "type": "object", "additionalProperties": false,
      "required": ["exact_receipt_duplicate", "semantic_evidence_duplicate", "prior_canonical_event_ids"],
      "properties": {
        "exact_receipt_duplicate": {"type": "boolean"},
        "semantic_evidence_duplicate": {"type": "boolean"},
        "prior_canonical_event_ids": {"type": "array", "maxItems": 16, "uniqueItems": true, "items": {"type": "string", "pattern": "^cevt_[0-9a-f]{64}$"}}
      }
    },
    "execution_profile": {
      "type": "object", "additionalProperties": false,
      "required": ["symbol", "base_tf", "mode", "execution_environment", "live_execution", "rr"],
      "properties": {
        "symbol": {"const": "XAUUSD"}, "base_tf": {"const": "1m"},
        "mode": {"const": "SHADOW"}, "execution_environment": {"const": "MT5_DEMO"},
        "live_execution": {"const": false}, "rr": {"const": 1.0}
      }
    },
    "audit": {
      "type": "object", "additionalProperties": false,
      "required": ["canonicalized_at", "validator_version", "receipt_provenance", "immutable_raw_reference", "replay_clock", "migration"],
      "properties": {
        "canonicalized_at": {"$ref": "#/$defs/utc"},
        "validator_version": {"const": "project-a-event-v1/1.3"},
        "receipt_provenance": {"const": "TRUSTED_INGRESS"},
        "immutable_raw_reference": {"type": "string", "pattern": "^[A-Za-z0-9][A-Za-z0-9._:-]{2,119}$"},
        "replay_clock": {"$ref": "#/$defs/nullableUtc"},
        "migration": {
          "anyOf": [
            {"type": "null"},
            {
              "type": "object", "additionalProperties": false,
              "required": ["source_contract", "adapter_version", "source_record_id"],
              "properties": {
                "source_contract": {"type": "string", "enum": ["EVENT_SCHEMA_V0_2", "PROJECT_A_WIRE_EVENT_V1"]},
                "adapter_version": {"type": "string", "pattern": "^[A-Za-z0-9][A-Za-z0-9._/-]{2,79}$"},
                "source_record_id": {"type": "string", "pattern": "^[A-Za-z0-9][A-Za-z0-9._:-]{2,127}$"}
              }
            }
          ]
        }
      }
    }
  },
  "$defs": {
    "utc": {"type": "string", "format": "date-time", "pattern": "^\\d{4}-\\d{2}-\\d{2}T\\d{2}:\\d{2}:\\d{2}(?:\\.\\d{1,3})?Z$"},
    "nullableUtc": {"anyOf": [{"type": "null"}, {"$ref": "#/$defs/utc"}]},
    "hash": {"type": "string", "pattern": "^sha256:[0-9a-f]{64}$"}
  }
}
