{"audit":{"canonicalized_at":"2026-07-16T01:01:01.300Z","immutable_raw_reference":"recorded_session3_wire_0001","migration":null,"receipt_provenance":"TRUSTED_INGRESS","replay_clock":"2026-07-16T01:01:01.300Z","validator_version":"project-a-event-v1/1.3"},"canonical_content_hash":"sha256:a42f53cee3cc581dc0bddbb536fbc3f444f6e1a4693e5e8c559473df33499a69","canonical_event_id":"cevt_a42f53cee3cc581dc0bddbb536fbc3f444f6e1a4693e5e8c559473df33499a69","causation_id":"wevt_xau_20260716_0999","contract_family":"PROJECT_A_CANONICAL_EVENT","correlation_id":"corr_xau_20260716_1001","dedupe":{"exact_receipt_duplicate":false,"prior_canonical_event_ids":[],"semantic_evidence_duplicate":false},"execution_profile":{"base_tf":"1m","execution_environment":"MT5_DEMO","live_execution":false,"mode":"SHADOW","rr":1,"symbol":"XAUUSD"},"receipt":{"raw_content_hash":"sha256:a42f53cee3cc581dc0bddbb536fbc3f444f6e1a4693e5e8c559473df33499a69","receipt_id":"rcpt_session3_sample_0001","received_at":"2026-07-16T01:01:01.250Z","source_adapter_identity":"session3_fixture_builder_v1","transport_identity":"recorded_session3_sample_0001"},"schema_version":"1.0","semantic_evidence_hash":"sha256:b9092c1e82e0bda8f83aef2bad0c566a8adc658958410c40403636bd93ed2517","setup_id":"setup_10389478bde01fe59035f0ab63e6f273","source_wire_version":"1.0","validation":{"dispatch_allowed":true,"reason_codes":["VALIDATED"],"state_mutation_allowed":false,"status":"ACCEPTED"},"wire_event":{"base_tf":"1m","causation_id":"wevt_xau_20260716_0999","contract_family":"PROJECT_A_WIRE_EVENT","correlation_id":"corr_xau_20260716_1001","emitted_at":"2026-07-16T01:01:01Z","event_class":"ANALYSIS_READY","event_type":"SNR_REJECTION_READY","evidence":{"break":null,"entry_window":null,"expiry":null,"geometry":{"direction":"LONG","entry":2416.5,"rr":1,"sl":2414.5,"tp":2418.5},"hpa":[{"bar_close":"2026-07-16T01:00:00Z","bar_id":"bar_xau_5m_0100","classification":"DISCOUNT","confirmation_state":"CONFIRMED","timeframe":"5m"},{"bar_close":"2026-07-16T01:00:00Z","bar_id":"bar_xau_15m_0100","classification":"DISCOUNT","confirmation_state":"CONFIRMED","timeframe":"15m"},{"bar_close":"2026-07-16T01:00:00Z","bar_id":"bar_xau_30m_0100","classification":"MIDDLE","confirmation_state":"CONFIRMED","timeframe":"30m"}],"invalidation":null,"momentum":[{"bar_close":"2026-07-16T01:01:00Z","bar_id":"bar_xau_1m_0101","classification":"POSITIVE","confirmation_state":"CONFIRMED","direction":"UP","timeframe":"1m"},{"bar_close":"2026-07-16T01:00:00Z","bar_id":"bar_xau_5m_0100","classification":"POSITIVE","confirmation_state":"CONFIRMED","direction":"UP","timeframe":"5m"},{"bar_close":"2026-07-16T01:00:00Z","bar_id":"bar_xau_15m_0100","classification":"NEUTRAL","confirmation_state":"CONFIRMED","direction":"NEUTRAL","timeframe":"15m"},{"bar_close":"2026-07-16T01:00:00Z","bar_id":"bar_xau_30m_0100","classification":"NEUTRAL","confirmation_state":"CONFIRMED","direction":"NEUTRAL","timeframe":"30m"}],"rejection":{"bar_id":"bar_xau_1m_0101","classification":"PRODUCER_CLASSIFIED_REJECTION","evidence_time":"2026-07-16T01:01:00Z","measurements":{"body":0.4,"lower_wick":0.7},"reaction_id":"reaction_xau_1001"},"snr":{"high":2416,"identity":"snr_xau_support_1001","low":2415,"side":"SUPPORT","type":"CLASSIC"},"trigger":{"evidence_time":"2026-07-16T01:01:00Z","identity":"trigger_reclaim_1001","price":2416.5}},"execution_environment":"MT5_DEMO","extensions":{"fixture_note":"baseline","observed_spread_points":8},"hypothesis":"LONG","live_execution":false,"mode":"SHADOW","occurred_at":"2026-07-16T01:01:00Z","path":"SNR_REJECTION","producer_event_id":"wevt_xau_20260716_1001","schema_version":"1.0","setup_origin":{"aoi_id":"aoi_xau_support_1001","origin_id":"origin_xau_asian_1001"},"source":{"diagnostics":{"build_note":"known-vector"},"producer":"fixture","producer_checksum":null,"profile":"project-a-shadow","version":"1.0.0"},"symbol":"XAUUSD"}}
